{
  "schema_version": "0.2",
  "greedyq_release": "0.2_2026-10-25_15d4d3e",
  "registry_sha256": "c3ea7f153233ec128b6beca1bfe41877aa70ed2dcca50f32f86237405ce9b24e",
  "object": "greedyQExperiment",
  "profile": "experiment",
  "modules": [
    "consent",
    "deployment-vercel-supabase",
    "export-surveydown",
    "governance-irb",
    "preregistration",
    "prolific"
  ],
  "resolved_components": [
    {
      "id": "core",
      "kind": "core",
      "version": "0.2.0-draft.1",
      "manifest": "guides/core/component.json",
      "manifest_sha256": "9960f277c68bac7643744b9ff20f62f98f575660793d40001332c099cb74551d"
    },
    {
      "id": "experiment",
      "kind": "profile",
      "version": "0.2.0-draft.1",
      "manifest": "guides/profiles/experiment/component.json",
      "manifest_sha256": "32b673998c323b2bbcdbf245353d8d71f011c9cb5ff48afd5d8d2c9791f160d7"
    },
    {
      "id": "governance-irb",
      "kind": "module",
      "version": "0.2.0-draft.1",
      "manifest": "guides/modules/governance-irb/component.json",
      "manifest_sha256": "a242bb84920b9514c43cdffa11b42f1b232bf722cfb703d9555cbb093e91ba2c"
    },
    {
      "id": "consent",
      "kind": "module",
      "version": "0.2.0-draft.1",
      "manifest": "guides/modules/consent/component.json",
      "manifest_sha256": "38d77987410483ad5e2506c2961c9f825d5d023f1284c20696d065825c9600dd"
    },
    {
      "id": "deployment-vercel-supabase",
      "kind": "module",
      "version": "0.2.0-draft.1",
      "manifest": "guides/modules/deployment-vercel-supabase/component.json",
      "manifest_sha256": "82383461a2abcd510736cea5174d2d8034162c15ff56112d6f8507deb8641952"
    },
    {
      "id": "export-surveydown",
      "kind": "module",
      "version": "0.2.0-draft.1",
      "manifest": "guides/modules/export-surveydown/component.json",
      "manifest_sha256": "7fe89dd0b67885873b2456154dbba4186be312dd8204a1974dafcbab991563a6"
    },
    {
      "id": "preregistration",
      "kind": "module",
      "version": "0.2.0-draft.1",
      "manifest": "guides/modules/preregistration/component.json",
      "manifest_sha256": "76c3b28e1a3e345979a15db46b5e68b02d6382ba097ceb72d0fa566f9770f8d9"
    },
    {
      "id": "prolific",
      "kind": "module",
      "version": "0.2.0-draft.1",
      "manifest": "guides/modules/prolific/component.json",
      "manifest_sha256": "10eb6f9cfde3fdb354dfb047c4cae1ad402407260fd8a772a057c90081d34b15"
    }
  ],
  "resolved_files": [
    {
      "component": "core",
      "path": "release.json",
      "sha256": "1771e78a1a39fb1e7cb1bf1bbe29bec1eb06d693923f37fd4cc01d3764123560"
    },
    {
      "component": "core",
      "path": "greedyq/localization.py",
      "sha256": "16c2b87d6217f3b7a26292f52270f1fefdd6c03b39a573ba2201bfa46a39449d"
    },
    {
      "component": "core",
      "path": "greedyq/locale-messages.json",
      "sha256": "828a40c39808aed1945a60f56636b8baaaf970f17585fdbce8a1e02955be57ad"
    },
    {
      "component": "core",
      "path": "docs/surveydown-compatibility-audit.md",
      "sha256": "8022181df50d3dd963297f97b24f3726581fc8adae25924df6c1c68f73e1be47"
    },
    {
      "component": "core",
      "path": "EXTERNAL-RETURNS.md",
      "sha256": "a8b0eab478851709e3800244e422ce583679c78688e2dfe5bf4e3bb9a023457e"
    },
    {
      "component": "core",
      "path": "greedyq/formatting.py",
      "sha256": "8fd9f5c651047689c796408445b3fe941c59d785b906df53eff67ba35541357d"
    },
    {
      "component": "core",
      "path": "PREREGISTRATION.md",
      "sha256": "5e591d4c3a82367cc03ae8ffc0ae450095595e0249ad6b5cb799d61f38bcf948"
    },
    {
      "component": "core",
      "path": "UPGRADING.md",
      "sha256": "11f423a8eff5445a9dd4028f03cc248dba6e5ef06430b5a711dc1e16b150713d"
    },
    {
      "component": "core",
      "path": "tools/upgrade_study.py",
      "sha256": "4c119a08d2b8c7b33197519c8a3deb284592bef7871d5f75f829f591887ae8ba"
    },
    {
      "component": "core",
      "path": "tools/resolve_guide.py",
      "sha256": "43bd76be9ca6fc61ba70f11a508ab00a88f1897bff13619b80af7df0e320d043"
    },
    {
      "component": "core",
      "path": "greedyq/osf_fields.py",
      "sha256": "06a6b117da1bcd2787262638271636bd8b03e720764d6462c7884b22c8a33313"
    },
    {
      "component": "core",
      "path": "greedyq/redirects.py",
      "sha256": "7f49acd235e1917d8b6f8de640f9968bfb007a783f761478ddf8be47cdb206ce"
    },
    {
      "component": "core",
      "path": "RANDOMIZATION.md",
      "sha256": "b2d7969c0e45a13b9ddd6133a62eae2888095399a98a9d917fe180ec4a62e2fb"
    },
    {
      "component": "core",
      "path": "docs/repeat-user-acceptance.md",
      "sha256": "1d6131dda5033f14c35cef0a1ac0f0ce45c14e8d59d6023235d2c0202e6a0fe1"
    },
    {
      "component": "core",
      "path": "ARCHIVING.md",
      "sha256": "2cd3f93025283bffa3efd204a3b9fa48b2baa9aa11cb19a61c63ea5d262d23d7"
    },
    {
      "component": "core",
      "path": "docs/cloud-lifecycle.md",
      "sha256": "816aac8a94445c775f02bc9a99e430d8af5ab137370dacf45eadc9d300ec6110"
    },
    {
      "component": "core",
      "path": "tools/cloud_lifecycle.cjs",
      "sha256": "2c3a74eab9ce8ba8b3c9b3e57b303a56692a127cc1eb4f7c9bcadd7f1c620e06"
    },
    {
      "component": "core",
      "path": "tools/archive_study.cjs",
      "sha256": "420a2a17128d4d4e5b3b822c58d1418de225583c9a71908d44bf67bb444fe117"
    },
    {
      "component": "core",
      "path": "greedyq/archive.py",
      "sha256": "eb576fee68764960ea2a734c5e44b258e00ca2992606a50cc37291cd2f2b633e"
    },
    {
      "component": "core",
      "path": "guides/core/guide.md",
      "sha256": "2a1f63d941a8b2e3f5825397afb1ce7900cef40399aff3108d2f49b23ca0af46"
    },
    {
      "component": "core",
      "path": "guides/core/communication.md",
      "sha256": "707ad574d9bf20e3a0d34c6d351332a74a0dd85b734a04b8629ef2939bf44cf9"
    },
    {
      "component": "core",
      "path": "guides/core/checkpoints.json",
      "sha256": "2f27f4fb6824b8de340dce5b8b82872a13142221aed43fc6c24b21bbc640deec"
    },
    {
      "component": "core",
      "path": "docs/greedyq-v0.2-spec.md",
      "sha256": "1feae0afa0903a1dd9adad72753849d944079bc8dd1e54cdfc4d54ff173c2019"
    },
    {
      "component": "core",
      "path": "docs/preview-ui-spec.md",
      "sha256": "1f299ece6e45ea77fdd3397e1ec29ee326e0af6bba33a0a9774e24edbfdbe2d7"
    },
    {
      "component": "core",
      "path": "schemas/ai/study-state.schema.json",
      "sha256": "0a75be2a29e382030d2c500dcc3144c91574fce235673904004ef999791e5ea5"
    },
    {
      "component": "core",
      "path": "schemas/ai/decision-log.schema.json",
      "sha256": "a937bf06a1249069de1f3bd997252bb11addec5956a0e6a0b8546a1f14bca188"
    },
    {
      "component": "core",
      "path": "schemas/ai/unresolved-decisions.schema.json",
      "sha256": "8876e4eb598a0e727fbe5df77c7aa0b3f68678a102942c585c7126c126307a3c"
    },
    {
      "component": "core",
      "path": "schemas/ai/generation-manifest.schema.json",
      "sha256": "ecd00180d3ed0caf61ce2fa201ef21cdff8a7404efae025d140b2c69252eb51e"
    },
    {
      "component": "core",
      "path": "schemas/ai/validation-report.schema.json",
      "sha256": "bb682c8950ccaf1e3a12145009ac843ec7fb4ed20bdf2a95fb1fe03b37b13d5d"
    },
    {
      "component": "core",
      "path": "schemas/preview-model.schema.json",
      "sha256": "578ae49e321c6524eae6afb3fc4a562c922b2b0ec1493ed54962d56ae8ef0aa3"
    },
    {
      "component": "core",
      "path": "web/greedyq-core.js",
      "sha256": "2c2c7ff922cc98b9853aca5f8080a88f7f1e5b7d4159e698efe3692c88c6dcb6"
    },
    {
      "component": "core",
      "path": "web/greedyq-runtime.css",
      "sha256": "a01301059304092c7b219c52e8c3d34900aa3430f07606bf9a673901e027a977"
    },
    {
      "component": "core",
      "path": "templates/browser/respondent.html",
      "sha256": "ca83475dbe4cfbb90cb92321a9ccff2473fceae02eb85be5dc3fbf85aedbc4d2"
    },
    {
      "component": "core",
      "path": "templates/browser/preview.html",
      "sha256": "701cde96abc93235a5048f8f2d44e0eab2e58bf4bb1c15b1ee147a86e628768e"
    },
    {
      "component": "core",
      "path": "templates/browser/studio.html",
      "sha256": "da427b818db268ab20c6967174e73dc14537ecdabf710192eb3e3410ac60504a"
    },
    {
      "component": "core",
      "path": "templates/supabase/002_browser_rpc.sql",
      "sha256": "56ba87cf87a92e714b408648f4b64579a6d5a7ee1bae8bb79b390e8435249514"
    },
    {
      "component": "core",
      "path": "templates/supabase/004_randomization.sql",
      "sha256": "959fcffdb0df4f753ff81e9733e72a925a357522aa0e5fc1dd125ced9718f519"
    },
    {
      "component": "core",
      "path": "templates/supabase/005_prolific.sql",
      "sha256": "cf67178ae3a6503b208e471686f043227a1c20d62e3d81060d76af71863bb52e"
    },
    {
      "component": "core",
      "path": "templates/supabase/006_withdrawal_preview.sql",
      "sha256": "b60808de5814f0a852db44a444d6d1b1e042ef6635860de2aaebdf642b9fc4b1"
    },
    {
      "component": "core",
      "path": "templates/supabase/007_answer_snapshot.sql",
      "sha256": "6d30ebdf1403c26864dc6d333e801cbcfe34eae3222883b07f6bfff970fc80f2"
    },
    {
      "component": "core",
      "path": "templates/supabase/connection-test.html",
      "sha256": "13bcb75f12c20dda36aeb27c608760e166d38bba130e3df0b73dbf9131522cdd"
    },
    {
      "component": "core",
      "path": "greedyq/__init__.py",
      "sha256": "5c97025d1bf1232befd71a4e2bfe7d49f4c1c3d34f7df2b1ff375037ce3a1c60"
    },
    {
      "component": "core",
      "path": "greedyq/__main__.py",
      "sha256": "dfeb1549b777813641a2cb6f76119716781e343f5e1e8cfe2ed01376f624f46f"
    },
    {
      "component": "core",
      "path": "greedyq/yaml_min.py",
      "sha256": "87f26691adc3c02864bc9ed92b7908977f7257210935b309b6cdf2851ab66b9e"
    },
    {
      "component": "core",
      "path": "greedyq/parser.py",